<?xml version="1.0" encoding="UTF-8"?>
<!ELEMENT sets (set+)>
<!ELEMENT set (number, name, parts, minifigures?, tag+)>
<!ELEMENT number (#PCDATA)>
<!ELEMENT name (#PCDATA)>
<!ELEMENT parts (#PCDATA)>
<!ELEMENT minifigures (#PCDATA)>
<!ELEMENT tag (#PCDATA)>
